{
  "$schema": "https://json-schema.org/draft/2020-12/schema",
  "title": "Trellis portable policy",
  "type": "object",
  "required": [
    "schema_version",
    "maintainer_name",
    "github_user",
    "harnesses"
  ],
  "properties": {
    "$schema": {
      "type": "string"
    },
    "comment": {
      "type": "string"
    },
    "schema_version": {
      "description": "Schema version for tracked portable Trellis policy.",
      "type": "integer",
      "const": 2
    },
    "trellis_root": false,
    "projects_root": false,
    "shared_infra_root": false,
    "user_home": false,
    "source_root": false,
    "release_remote": false,
    "active_cli_release": false,
    "default_fleet": false,
    "fleets": false,
    "maintainer_name": {
      "type": "string",
      "minLength": 1
    },
    "github_user": {
      "type": "string",
      "minLength": 1
    },
    "trellis_version": {
      "description": "Optional. Semver of the canonical core-rules this clone is pinned to. Read by scripts/upgrade.sh.",
      "type": "string",
      "pattern": "^[0-9]+\\.[0-9]+\\.[0-9]+(-[0-9A-Za-z.-]+)?(\\+[0-9A-Za-z.-]+)?$"
    },
    "harnesses": {
      "type": "array",
      "minItems": 1,
      "items": {
        "enum": [
          "claude",
          "codex"
        ]
      },
      "uniqueItems": true
    },
    "symlink_style": false,
    "fleet": false,
    "installed_release": false,
    "presets": {
      "description": "Optional. List of preset rule-layers to load on top of the parent rules. Each entry must match a file under core-rules/presets/<name>.md. Symlinks land at <project>/.claude/rules/preset-<name>.md and <project>/.agents/rules/preset-<name>.md (under Codex). Order is preserved \u2014 later entries compose on top of earlier ones.",
      "type": "array",
      "items": {
        "type": "string",
        "pattern": "^[a-z0-9][a-z0-9-]*[a-z0-9]$",
        "minLength": 2,
        "maxLength": 64
      },
      "uniqueItems": true
    },
    "template": {
      "type": "object",
      "properties": {
        "remote": {
          "description": "Optional portable Git remote. Present values must be HTTPS, ssh://, or git@host:path Git remotes.",
          "type": "string",
          "minLength": 1,
          "allOf": [
            {
              "not": {
                "pattern": "\\\\"
              }
            },
            {
              "anyOf": [
                {
                  "pattern": "^https://[A-Za-z0-9][A-Za-z0-9.-]*(?::[0-9]+)?/[^\\s\\u0000-\\u001F\\u007F]+$"
                },
                {
                  "pattern": "^ssh://(?:[A-Za-z0-9._-]+@)?[A-Za-z0-9][A-Za-z0-9.-]*(?::[0-9]+)?/[^\\s\\u0000-\\u001F\\u007F]+$"
                },
                {
                  "pattern": "^git@[A-Za-z0-9][A-Za-z0-9.-]*:[^:\\s\\u0000-\\u001F\\u007F]+$"
                }
              ]
            }
          ]
        },
        "branch": {
          "description": "Optional single Git branch or ref name. Present values must satisfy conservative Git ref safety rules.",
          "type": "string",
          "minLength": 1,
          "allOf": [
            {
              "not": {
                "pattern": "\\\\"
              }
            },
            {
              "pattern": "^[A-Za-z0-9](?!.*\\.\\.)(?!.*@\\{)(?!.*//)(?!.*(?:/\\.{1,2})(?:/|$))(?!.*\\.lock(?:/|$))(?!.*[./]$)[^\\s\\u0000-\\u001F\\u007F~^:?*\\[]*$"
            }
          ]
        },
        "redact_paths": {
          "type": "array",
          "items": {
            "description": "Portable repository-relative path. A trailing slash is allowed for a directory redaction.",
            "type": "string",
            "minLength": 1,
            "allOf": [
              {
                "not": {
                  "pattern": "\\\\"
                }
              },
              {
                "pattern": "^(?![-/])(?![A-Za-z]:)(?!\\.{1,2}(?:/|$))(?!.*(?:/\\.{1,2})(?:/|$))[^/\\u0000-\\u001F\\u007F]+(?:/[^/\\u0000-\\u001F\\u007F]+)*/?$"
              }
            ]
          }
        }
      },
      "additionalProperties": true
    },
    "sed_flavor": {
      "enum": [
        "auto",
        "gnu",
        "bsd"
      ]
    },
    "approved_mcps": {
      "description": "Optional. Allowlist of MCP server names sanctioned for use across registered projects. Today this is documentation only \u2014 projects MAY connect MCPs not listed here. An operator audit may warn when a project's .mcp.json references an unapproved server. Names match the server name as exposed to the harness (e.g., the prefix before '__' in mcp__<server>__<tool>). Examples: 'operator-scheduler', 'computer-use', 'claude-in-chrome', 'Vercel', 'Cloudflare', 'obsidian'.",
      "type": "array",
      "items": {
        "type": "object",
        "required": [
          "name"
        ],
        "properties": {
          "name": {
            "type": "string",
            "minLength": 1
          },
          "purpose": {
            "type": "string"
          },
          "scope": {
            "description": "'fleet' = enabled across all registered projects; 'per-project' = only where the project explicitly opts in.",
            "enum": [
              "fleet",
              "per-project"
            ]
          }
        },
        "additionalProperties": true
      },
      "uniqueItems": true
    },
    "autonomy_default": {
      "description": "Optional. Fleet default autonomy level (integer 1\u20135) used by every session under this clone unless overridden. 1=pedagogical, 2=cautious, 3=standard (default), 4=initiative, 5=autonomous. Project-local <project>/.trellis.config.json may override with its own 'autonomy' field. Presets may clamp via 'autonomy_ceiling'.",
      "type": "integer",
      "minimum": 1,
      "maximum": 5
    },
    "autonomy": {
      "description": "Optional. Project-local override of autonomy_default. Same range and semantics. Used only in project-local <project>/.trellis.config.json files, but accepted at fleet-level for symmetry.",
      "type": "integer",
      "minimum": 1,
      "maximum": 5
    },
    "package_manager": {
      "description": "Optional. Default JS package manager for hooks and gates that run project scripts (pre-push, stop-verify, process-gate). 'auto' (the default when unset) = detect from lockfile: pnpm-lock.yaml\u2192pnpm, bun.lock(b)\u2192bun, yarn.lock\u2192yarn, package-lock.json\u2192npm. An explicit value (pnpm|npm|bun|yarn) forces that manager regardless of lockfile. Project-local <project>/.trellis.config.json may override with its own 'package_manager'. With the key unset, resolution is byte-identical to pre-config Trellis (pure lockfile detection) \u2014 this key is purely additive.",
      "enum": [
        "auto",
        "pnpm",
        "npm",
        "bun",
        "yarn"
      ]
    },
    "conductor": {
      "description": "Optional. Fleet conductor autonomy controls. Every key is optional. auto_execute_top_n defaults to 0, preserving rank/auto-spec-only behavior; a positive value permits only that many reviewed-ready safe items from the same run to execute to [HOLD] PRs. The conductor never merges.",
      "type": "object",
      "properties": {
        "auto_execute_top_n": {
          "description": "Maximum reviewed-ready safe conductor items per run that may execute to [HOLD] PRs. Default 0 (disabled). Must be explicitly positive to enable execution; never permits merge.",
          "type": "integer",
          "minimum": 0
        }
      },
      "additionalProperties": true
    },
    "disk_janitor": {
      "description": "Optional. Tuning for `trellis disk-janitor`. Every key is optional; the orchestrator fills per-key defaults when the key or the whole object is absent (enabled true; cache_ttl_days 14; release_staging_ttl_days 1; worktree_stale_days 30; free_space_floor_gb 30; cache_ceiling_gb 20; skip_projects []; reap_pushed_worktrees true; ephemeral_tmp_ttl_days 2; worktree_count_ceiling 25; worktree_total_gb_ceiling 80). Absence of the object is byte-identical to the defaults \u2014 this key is purely additive.",
      "type": "object",
      "properties": {
        "enabled": {
          "description": "Master switch for the disk-janitor scans. Default true.",
          "type": "boolean"
        },
        "cache_ttl_days": {
          "description": "A build-cache directory is a prune candidate only when its mtime is older than this many days. Default 14.",
          "type": "integer",
          "minimum": 0
        },
        "release_staging_ttl_days": {
          "description": "An execution snapshot may be reaped only when its mtime is older than this many days and its owner identity is absent or no longer live. Default 1.",
          "type": "integer",
          "minimum": 0
        },
        "worktree_stale_days": {
          "description": "A worktree is a reap candidate only when its last commit is older than this many days. Applies only to the legacy predicate (reap_pushed_worktrees=false); the default Layer-2 predicate drops staleness (age is irrelevant once work is recoverable). Default 30.",
          "type": "integer",
          "minimum": 0
        },
        "free_space_floor_gb": {
          "description": "Tripwire: report flags low disk when free space on the projects volume drops below this many GB. Default 30.",
          "type": "integer",
          "minimum": 0
        },
        "cache_ceiling_gb": {
          "description": "Tripwire: report flags a runaway cache when the largest single build cache exceeds this many GB. Default 20.",
          "type": "integer",
          "minimum": 0
        },
        "reap_pushed_worktrees": {
          "description": "Layer 2 predicate switch. Default true: a linked worktree auto-reaps when it is porcelain-clean AND recoverable (branch merged via gh OR pushed to origin with the local tip not ahead) AND carries no gitignored secret \u2014 age-independent, which is what reclaims the unmerged-but-pushed fan-out flood. Set false to restore the legacy 4-gate predicate (non-main AND stale AND clean(allowlist) AND merged) verbatim.",
          "type": "boolean"
        },
        "ephemeral_tmp_ttl_days": {
          "description": "Short TTL for porcelain-clean worktrees under /private/tmp (throwaway on reboot): such a tree auto-reaps once its last commit is older than this many days even when recoverability cannot be verified (no upstream), provided the branch is not detached. Only consulted under the default predicate. Default 2.",
          "type": "integer",
          "minimum": 0
        },
        "worktree_count_ceiling": {
          "description": "Layer 3 tripwire: the report WARNs when any single repo exceeds this many linked worktrees, so a fan-out flood is visible days before the free-space floor is breached. Default 25.",
          "type": "integer",
          "minimum": 0
        },
        "worktree_total_gb_ceiling": {
          "description": "Layer 3 tripwire: the report WARNs when the aggregate footprint of all linked worktrees across the fleet exceeds this many GB. Default 80.",
          "type": "integer",
          "minimum": 0
        },
        "skip_projects": {
          "description": "Local-registry project ids the janitor never scans or touches, on top of the registry's own excluded rows. Default [].",
          "type": "array",
          "items": {
            "type": "string",
            "minLength": 1
          },
          "uniqueItems": true
        }
      },
      "additionalProperties": true
    },
    "loop_safety": {
      "description": "Optional. Instance baseline for the loop-safety contract (core-rules/loop-safety.md). Every Trellis loop declares and honors three ceilings and halts on ANY one. Every key is optional; absence of a key or of the whole object falls back to the documented built-in fallback constants identical to these baselines (max_iterations 100; no_progress_iterations 3; budget_ceiling_usd 1000; usd_per_mtok 25.00). The optional codex_usd_per_mtok has no baseline constant: absent, cross-harness Codex spend is attributed at usd_per_mtok (backward compatible). Resolution, most specific wins: per-loop `safety` override \u2192 project-local <project>/.trellis.config.json.loop_safety \u2192 this central block \u2192 built-in fallback constants. Absence of the object is byte-identical to the defaults \u2014 this key is purely additive.",
      "type": "object",
      "properties": {
        "max_iterations": {
          "description": "Hard cap on loop iterations / agent-dispatch rounds; the loop halts when reached. Complements (does not replace) the Workflow engine's 1000-agent lifetime backstop. Default 100.",
          "type": "integer",
          "minimum": 1
        },
        "no_progress_iterations": {
          "description": "Halt after this many consecutive iterations that make no measurable progress, where 'progress' is the loop's declared progress signal (commit/PR, file delta, new finding, work-list drain, or state-hash change as catch-all). Default 3.",
          "type": "integer",
          "minimum": 1
        },
        "budget_ceiling_usd": {
          "description": "Spend ceiling per loop run, in US dollars; the loop halts when reached. Mapped onto the Workflow engine's token-native budget.total via usd_per_mtok. Default 1000.",
          "type": "number",
          "minimum": 0
        },
        "usd_per_mtok": {
          "description": "US dollars per million output tokens, used to convert budget_ceiling_usd to the engine's token-native budget (budget_tokens = round(budget_ceiling_usd / usd_per_mtok * 1_000_000)). Tracks the loop model's output price; update here when pricing changes. Default 25.00 (Claude Opus 4.8 output, $25/MTok).",
          "type": "number",
          "minimum": 0
        },
        "codex_usd_per_mtok": {
          "description": "Optional. US dollars per million output tokens for the GPT-5.x / Codex model, used by cross-harness loops so Codex-unit spend is attributed at the Codex rate rather than the Opus rate when mapping budget_ceiling_usd onto the engine's token budget. Absent \u2192 Codex spend falls back to usd_per_mtok (backward compatible). Note: Codex's per-task cost win is mostly ~3-4x fewer tokens, not a lower per-MTok rate; set this to Codex's real output price, not a fudge factor.",
          "type": "number",
          "minimum": 0
        }
      },
      "additionalProperties": true
    },
    "mandatory_pipeline": {
      "description": "Optional. The mandatory feature-pipeline gate (spec 006; core-rules/hooks.md). When enabled, a branch whose net gated diff vs the protected merge-base (excluding tests/docs/specs/audits/lockfiles/generated/operational paths) exceeds spec_required_diff_lines cannot be pushed unless ONE of three routes is satisfied: a spec triad added on THIS branch (+ an interview artifact), a size-capped `/surgical` declaration (net gated diff \u2264 surgical_max_diff_lines), or a logged `/surgical --emergency` override. Enforced deterministically at pre-push \u2014 a pure function of git/filesystem state, so it is equal on Claude and Codex by construction \u2014 with a Stop-hook early-warning. Every key is optional; absence of the object, or enabled:false, is byte-identical to prior behavior (default OFF). A present-but-malformed block fails CLOSED (an opted-in project must not be silently disabled by a typo). Resolution, most specific wins: project-local <project>/.trellis.config.json.mandatory_pipeline \u2192 this central block \u2192 built-in (off, floor 80, ceiling 400).",
      "type": "object",
      "properties": {
        "enabled": {
          "description": "Master switch for the mandatory-pipeline gate. Default false \u2014 absence or false is byte-identical to pre-006 behavior.",
          "type": "boolean"
        },
        "spec_required_diff_lines": {
          "description": "Size floor: net gated diff (added+deleted, excluded paths removed) at or below this many lines is treated as sub-floor and passes with no spec (surgical-by-default). Above it, the branch must take one of the three routes. Default 80.",
          "type": "integer",
          "minimum": 1
        },
        "surgical_max_diff_lines": {
          "description": "Surgical ceiling: a `/surgical` declaration is honored only while the net gated diff stays at or below this many lines. Grow past it and the marker is invalid \u2014 the gate re-blocks and audit-logs an `oversized-surgical` line; use `/surgical --emergency` for genuine over-cap urgency. Default 400.",
          "type": "integer",
          "minimum": 1
        }
      },
      "additionalProperties": true
    },
    "aeo_gate": {
      "description": "Optional Spec 033 warn-only AEO diff adapter. Absence or enabled:false is byte-identical to pre-033 behavior. When enabled, changed public-page source files are compared with an accepted deterministic baseline; every status remains non-blocking during initial rollout.",
      "type": "object",
      "properties": {
        "enabled": {
          "type": "boolean"
        },
        "project": {
          "type": "string",
          "minLength": 1
        },
        "url": {
          "type": "string",
          "format": "uri",
          "minLength": 1
        },
        "marker_file": {
          "description": "Portable repository-relative source path.",
          "type": "string",
          "minLength": 1,
          "allOf": [
            {
              "not": {
                "pattern": "\\\\"
              }
            },
            {
              "pattern": "^(?![-/])(?![A-Za-z]:)(?!\\.{1,2}(?:/|$))(?!.*(?:/\\.{1,2})(?:/|$))[^/\\u0000-\\u001F\\u007F]+(?:/[^/\\u0000-\\u001F\\u007F]+)*$"
            }
          ]
        },
        "marker": {
          "type": "string",
          "minLength": 1
        },
        "baseline": {
          "description": "Portable repository-relative path to the accepted AEO baseline.",
          "type": "string",
          "minLength": 1,
          "allOf": [
            {
              "not": {
                "pattern": "\\\\"
              }
            },
            {
              "pattern": "^(?![-/])(?![A-Za-z]:)(?!\\.{1,2}(?:/|$))(?!.*(?:/\\.{1,2})(?:/|$))[^/\\u0000-\\u001F\\u007F]+(?:/[^/\\u0000-\\u001F\\u007F]+)*$"
            }
          ]
        }
      },
      "allOf": [
        {
          "if": {
            "properties": {
              "enabled": {
                "const": true
              }
            },
            "required": [
              "enabled"
            ]
          },
          "then": {
            "required": [
              "project",
              "url",
              "marker_file",
              "marker",
              "baseline"
            ]
          }
        }
      ],
      "additionalProperties": true
    }
  },
  "additionalProperties": true
}
