{
  "$schema": "./scripts/lib/trellis.config.schema.json",
  "schema_version": 2,
  "comment": "Tracked portable Trellis policy. Configure machine roots, fleet settings, release remote, and attachment state in TRELLIS_HOME, never in this file.",
  "maintainer_name": "__MAINTAINER_NAME__",
  "github_user": "__GITHUB_USER__",
  "harnesses": ["claude"],
  "template": {
    "remote": "https://example.invalid/trellis.git",
    "branch": "main"
  }
}
